{
  "schema": "vega/explain-catalog@1",
  "backend": "pytorch",
  "language": "python",
  "source": "references/backend-contract.md §2.2; references/schemas/explain-catalog-1.schema.json",
  "note": "The backend-owned text of the showcase page's stepper and code walk for this backend: per block type its stage kind, words, formula, prose, recompute and code anchor; per activation its curve and bend; per link its formula and answer rule; and the fixed walk steps. vega-show copies the subset a lane uses into page.json. Prose follows the digit rule: no digit outside a placeholder. tests/test_explain_catalog_sync.py keeps it in step with coverage.json, the catalog, the blocks and the page's walk.",
  "placeholders": {
    "units": "the stage's output width: its units, outputs or numbers per position",
    "inputs": "the stage's input width: the numbers each unit reads",
    "kernel": "the convolution's kernel length",
    "channels": "the convolution's output channels",
    "hidden": "the recurrent state's width",
    "heads": "the attention heads",
    "layers": "the stacked layers of an encoder or a recurrent block",
    "z": "the latent code's width",
    "n_sub": "the input width written as a subscript, for the last term of a sum",
    "slope": "the negative slope of a LeakyReLU, the activation's or the graph attention's",
    "eps": "the small constant added under a square root",
    "p": "the dropout rate",
    "v": "the letter of the stage's input: x for the shaped inputs, a for the outputs of the layer before"
  },
  "recompute": {
    "weighted_sum": {
      "explainer": "dense",
      "what": "one unit's weighted sum of its inputs plus its bias, then its activation"
    },
    "cumulative_score": {
      "explainer": "dense",
      "what": "the ordinal head's shared score plus each ordered threshold"
    },
    "elementwise": {
      "explainer": "dense",
      "what": "the activation applied to each number on its own"
    },
    "lookup": {
      "explainer": "embedding",
      "what": "the table row a nominal value picks"
    },
    "batchnorm": {
      "explainer": "norm",
      "what": "each unit shifted and rescaled with the running statistics fitted in training"
    },
    "layernorm": {
      "explainer": "norm",
      "what": "the vector centred and scaled by its own mean and spread, then each unit's gain and shift"
    },
    "residual_sum": {
      "explainer": "residual",
      "what": "the block's input, projected when the widths differ, plus what its inner layers computed"
    },
    "branch_merge": {
      "explainer": "residual",
      "what": "the branches' outputs laid side by side, or added"
    },
    "conv1d": {
      "explainer": "conv",
      "what": "one output channel at one position from the kernel, the bias and the input under the window"
    },
    "pool1d": {
      "explainer": "pool",
      "what": "one pooled value: the maximum or the mean of its group of positions"
    },
    "rnn_step": {
      "explainer": "recurrent",
      "what": "one step of one unit: the bent sum of the input and the previous state"
    },
    "gru_step": {
      "explainer": "recurrent",
      "what": "one step of one unit: the reset and update gates, the candidate and the new state"
    },
    "lstm_step": {
      "explainer": "recurrent",
      "what": "one step of one unit: the input, forget and output gates, the candidate, the cell and the output"
    },
    "attention_row": {
      "explainer": "attention",
      "what": "one query position's attention weights and its weighted mix of the values"
    },
    "attention_pool": {
      "explainer": "attention",
      "what": "the step weights from the score and query layers, and the weighted sum of the states"
    },
    "transformer_layer": {
      "explainer": "attention",
      "what": "one encoder layer: the attention part and the feed-forward part, each added back"
    },
    "token_affine": {
      "explainer": "attention",
      "what": "one input's token from its learned vector and bias, or its table row"
    },
    "pool_reduce": {
      "explainer": "pool",
      "what": "the mean, the maximum or the first position over the sequence"
    },
    "latent_mean": {
      "explainer": "latent",
      "what": "the mean half of the input, which is the code while answering"
    },
    "gcn_message": {
      "explainer": "graph",
      "what": "one node's sum of its neighbours' projected vectors times their normalised coefficients, plus the bias"
    },
    "sage_message": {
      "explainer": "graph",
      "what": "one node's own projection plus the projection of its neighbours' aggregate"
    },
    "gat_message": {
      "explainer": "graph",
      "what": "one node's attention coefficients per head and the weighted sum of its neighbours"
    },
    "gin_message": {
      "explainer": "graph",
      "what": "one node's scaled own vector plus its neighbours' sum, through the small network"
    },
    "graph_readout": {
      "explainer": "graph",
      "what": "the sum, mean or maximum over one graph's nodes"
    },
    "none": {
      "explainer": "generic",
      "what": "nothing is recomputed: the formula and the shapes only"
    }
  },
  "blocks": {
    "dense": {
      "stage_kind": "dense",
      "label": "dense layer",
      "label_many": "dense layers",
      "step": "layer",
      "formula": "z = w₁·{v}₁ + w₂·{v}₂ + … + w{n_sub}·{v}{n_sub} + b ; a = f(z)",
      "prose": "Each of the {units} units of this layer adds up the {inputs} numbers it receives, each times a weight of its own, plus a bias; then its activation, if it has one, bends the sum:",
      "unit_how": "A unit takes every number of the layer before it, multiplies each by a weight of its own, and adds them up with one more number, its bias. Then the activation bends the sum; without that bend, all the layers together would be no more than one weighted sum.",
      "recompute": "weighted_sum",
      "reads": [
        "linear",
        "act"
      ],
      "code": {
        "file": "(^|/)blocks_core\\.py$",
        "at": [
          "^class Dense\\b"
        ],
        "after": null,
        "to": null
      },
      "walk": {
        "title": "A dense layer: z = W·x + b",
        "text": "One matrix product plus a bias. W is the grid of weights the network page draws as edges; one row of it times the inputs, plus one bias, is the z that the stepper adds up term by term."
      }
    },
    "embedding": {
      "stage_kind": "embedding",
      "label": "embedding",
      "label_many": "embeddings",
      "step": "embedding",
      "formula": "e = E[id] ; h = [e₁ ‖ … ‖ e_C]",
      "prose": "Each nominal {feature.one} has a table of its own, one row per value it took in training: the value picks its row, a short list of learned numbers, and the rows of every nominal {feature.one} are laid side by side. A value never seen in training takes the table's reserved last row.",
      "unit_how": "An embedding does no arithmetic: it looks a value up and hands on the row of learned numbers that stands for it, so values that act alike end up with rows that look alike.",
      "recompute": "lookup",
      "reads": [
        "columns",
        "embeddings"
      ],
      "code": {
        "file": "(^|/)blocks_core\\.py$",
        "at": [
          "^class Embedding\\b"
        ],
        "after": null,
        "to": null
      },
      "walk": {
        "title": "Nominal values as learned numbers",
        "text": "One table per nominal {feature.one}, each row a short vector the training moved like any other weight. The id the recipe gave the value picks the row, and the recipe's reserved id for unseen values picks the last one, so a new value is answered rather than refused."
      }
    },
    "concat": {
      "stage_kind": "concat",
      "label": "join",
      "label_many": "joins",
      "step": "join",
      "formula": "h = [x ‖ e₁ ‖ … ‖ e_C]",
      "prose": "The numeric inputs and every embedding row are laid side by side into one list of numbers; nothing is computed.",
      "unit_how": "A join computes nothing: it places the numeric inputs and the embedded nominal ones side by side, so the next layer reads them all as one list.",
      "recompute": "none",
      "reads": [],
      "code": {
        "file": "(^|/)blocks_core\\.py$",
        "at": [
          "^class Concat\\b"
        ],
        "after": null,
        "to": null
      },
      "walk": {
        "title": "Numbers and embeddings, side by side",
        "text": "The numeric inputs and the embedding rows are joined into one list, the width the next layer reads: the numeric {feature.many} first, then the row of each nominal {feature.one} in the contract's order."
      }
    },
    "batchnorm": {
      "stage_kind": "norm",
      "label": "batch normalisation",
      "label_many": "batch normalisations",
      "step": "normalisation",
      "formula": "y = γ·(x − μ) / √(σ² + ε) + β",
      "prose": "While answering, each of the {units} units is shifted and rescaled with numbers fitted in training: μ and σ² are the running mean and variance it saw, γ and β its learned gain and shift, and ε = {eps} keeps the division safe:",
      "unit_how": "A normalised unit subtracts the mean it saw in training, divides by the spread it saw, and then applies a learned gain and shift, so the next layer always reads numbers on a familiar scale.",
      "recompute": "batchnorm",
      "reads": [
        "bn"
      ],
      "code": {
        "file": "(^|/)blocks_core\\.py$",
        "at": [
          "^class BatchNorm\\b"
        ],
        "after": null,
        "to": null
      },
      "walk": {
        "title": "Batch normalisation, frozen for answering",
        "text": "In training this layer measured the mean and variance of each unit over each batch and kept running averages of them. While answering it uses only those running values, so the answer for a {row.one} never depends on the other {row.many} of the request."
      }